{
  "id": "dev.vitruvian.samples.hello-swift",
  "name": { "en": "Hello, in Swift" },
  "description": { "en": "Says hello, and counts one more each time." },
  "version": "0.1.0",
  "protocol": "1",
  "publisher": "VitruvianSoftware",
  "license": "MIT",
  "icon": "swift",
  "uses": ["notify", "storage"],
  "contributes": {
    "commands": [
      {
        "id": "hello",
        "title": { "en": "Say hello from Swift" },
        "icon": "hand.wave",
        "surfaces": ["commandBar", "radial", "quickPanel", "shortcut"]
      },
      {
        "id": "count",
        "title": { "en": "Count one more" },
        "icon": "number",
        "surfaces": ["commandBar"]
      }
    ]
  },
  "preferences": [{ "id": "count", "type": "integer", "default": 0 }],
  "activation": ["onCommand"],
  "runtime": { "kind": "external", "exec": "bin/tool" }
}
